{
  "adapter_id": "codex",
  "adapter_version": "pcodex.codex-agent-adapter.v1",
  "supported_platforms": ["darwin", "linux"],
  "supported_agent_versions": ["0.143.x"],
  "lifecycle_operations": [
    "preview",
    "install",
    "status",
    "discovery",
    "repair",
    "disable",
    "reinstall",
    "uninstall"
  ],
  "workspace_binding": "configured_root_immutable",
  "exact_task_transport": "single_canonical_field",
  "schema_version": "pcodex.agent-adapter-contract.v1",
  "sensitivity_classification": "public_safe"
}
